<?xml version="1.0" encoding="UTF-8"?>
<!DOCTYPE escuela SYSTEM "Escuela.dtd">
<escuela>
    <centros>
        <centro nombre="Sede Tecnológica" sede="Cartuja">
            <ciclo nombre="DAM">
                <asignatura id="BD" nombre="Base de Datos" curso="1"/>
                <asignatura id="DWES" nombre="Desarrollo Web Entorno Servidor" curso="2">
                    <prerrequisito ref="BD"/>
                </asignatura>
            </ciclo>
        </centro>
    </centros>

    <alumnos>
        <alumno dni="DNI12345678X" nombre="Juan Pérez" acceso="Bachillerato"> <!-- Los ID no pueden empezar por números-->
            <matricula asignatura="BD" periodo_academico="2023-2024"/>
            <matricula asignatura="BD" periodo_academico="2024-2025"/>

        </alumno>
    </alumnos>

    <docentes>
        <docente dni="DNI98765432Y" nombre="Ana Martínez">
            <imparte asignatura="BD" anyo="2024"/>
        </docente>
    </docentes>
</escuela>